{
  "$schema": "https://json-schema.org/draft/2020-12/schema",
  "type": "object",
  "required": ["seed", "identity", "composition", "field", "stars", "motion", "anchors", "galaxies"],
  "properties": {
    "seed": {"type": "string", "minLength": 1},
    "identity": {
      "type": "object",
      "required": ["family", "label", "presence"],
      "properties": {
        "family": {"enum": ["monogram", "eclipse", "quiet_star", "minimal_ring", "black_hole", "pulsar", "binary_star", "protostar_nebula"]},
        "label": {"type": "string", "minLength": 1},
        "monogram": {"type": ["string", "null"]},
        "avatar": {"type": ["string", "null"]},
        "presence": {
          "type": "object",
          "required": ["mode", "subtitle"],
          "properties": {
            "mode": {"enum": ["brief_intro", "quiet"]},
            "subtitle": {"type": ["string", "null"]}
          }
        }
      }
    },
    "composition": {
      "type": "object",
      "required": ["archetype", "asymmetry", "openness", "dominant_axis"],
      "properties": {
        "archetype": {"enum": ["dominant_core_satellites", "dual_core", "three_islands", "stream", "sparse_archipelago", "compact_cluster", "asymmetric_chain"]},
        "asymmetry": {"type": "number", "minimum": 0, "maximum": 1},
        "openness": {"type": "number", "minimum": 0, "maximum": 1},
        "dominant_axis": {"enum": ["horizontal", "vertical", "diagonal", "radial", "none"]}
      }
    },
    "field": {
      "type": "object",
      "required": ["density", "dust_family", "temperature_bias"],
      "properties": {
        "density": {"enum": ["very_sparse", "sparse", "medium", "dense"]},
        "dust_family": {"enum": ["almost_empty", "cold_filament", "broken_cloud"]},
        "temperature_bias": {"enum": ["cool", "cool_neutral", "neutral", "warm_neutral", "warm"]}
      }
    },
    "stars": {
      "type": "object",
      "required": ["family", "temperature_variation"],
      "properties": {
        "family": {"const": "subtle_point"},
        "temperature_variation": {"enum": ["low", "medium"]}
      }
    },
    "motion": {
      "type": "object",
      "required": ["temperament"],
      "properties": {
        "temperament": {"enum": ["quiet", "balanced", "lively"]}
      }
    },
    "anchors": {
      "type": "array",
      "items": {
        "type": "object",
        "required": ["id", "role", "prominence", "galaxies"],
        "properties": {
          "id": {"type": "string", "minLength": 1},
          "role": {"const": "provenance"},
          "prominence": {"enum": ["low", "medium"]},
          "galaxies": {"type": "array", "minItems": 1, "items": {"type": "string"}}
        }
      }
    },
    "galaxies": {
      "type": "array",
      "items": {
        "type": "object",
        "required": ["id", "mass", "morphology", "dominance"],
        "properties": {
          "id": {"type": "string", "minLength": 1},
          "mass": {"type": "number", "minimum": 0, "maximum": 1},
          "morphology": {"enum": ["compact", "elongated", "stream", "cloud", "ring", "fragmented"]},
          "dominance": {"type": "number", "minimum": 0, "maximum": 1}
        }
      }
    }
  }
}
