{"seed":"kc:cleanroom:v2:magdalenemc:2026-08-18","identity":{"family":"quiet_star","label":"magdalenemc","monogram":"M","avatar":null,"presence":{"mode":"brief_intro","subtitle":"由极少公开技术痕迹形成的知识星图"}},"composition":{"archetype":"sparse_archipelago","asymmetry":0.18,"openness":0.92,"dominant_axis":"none"},"field":{"density":"very_sparse","dust_family":"almost_empty","temperature_bias":"neutral"},"stars":{"family":"subtle_point","temperature_variation":"low"},"motion":{"temperament":"quiet"},"anchors":[{"id":"A1","role":"provenance","prominence":"low","galaxies":["G1"]}],"galaxies":[{"id":"G1","mass":0.32,"morphology":"compact","dominance":0.55}]}