{"seed":"kc:cleanroom:v2:simonw:2026-08-18","identity":{"family":"minimal_ring","label":"Simon Willison","monogram":"SW","avatar":null,"presence":{"mode":"brief_intro","subtitle":"由长期开放工具与产品实践生长出的知识星图"}},"composition":{"archetype":"three_islands","asymmetry":0.36,"openness":0.58,"dominant_axis":"diagonal"},"field":{"density":"sparse","dust_family":"cold_filament","temperature_bias":"cool_neutral"},"stars":{"family":"subtle_point","temperature_variation":"low"},"motion":{"temperament":"balanced"},"anchors":[{"id":"A1","role":"provenance","prominence":"medium","galaxies":["G1"]},{"id":"A2","role":"provenance","prominence":"medium","galaxies":["G2"]},{"id":"A3","role":"provenance","prominence":"medium","galaxies":["G3"]}],"galaxies":[{"id":"G1","mass":0.9,"morphology":"compact","dominance":0.9},{"id":"G2","mass":0.82,"morphology":"elongated","dominance":0.83},{"id":"G3","mass":0.86,"morphology":"compact","dominance":0.87}]}