{"seed":"kc:cleanroom:v2:sharkdp:2026-08-18","identity":{"family":"minimal_ring","label":"sharkdp","monogram":"S","avatar":null,"presence":{"mode":"brief_intro","subtitle":"由终端工具、基准测量与科学计算语言形成的知识星图"}},"composition":{"archetype":"three_islands","asymmetry":0.42,"openness":0.56,"dominant_axis":"diagonal"},"field":{"density":"sparse","dust_family":"almost_empty","temperature_bias":"cool_neutral"},"stars":{"family":"subtle_point","temperature_variation":"low"},"motion":{"temperament":"balanced"},"anchors":[{"id":"A1","role":"provenance","prominence":"medium","galaxies":["G1"]},{"id":"A2","role":"provenance","prominence":"medium","galaxies":["G2"]},{"id":"A3","role":"provenance","prominence":"medium","galaxies":["G3"]}],"galaxies":[{"id":"G1","mass":0.82,"morphology":"compact","dominance":0.8},{"id":"G2","mass":0.84,"morphology":"compact","dominance":0.82},{"id":"G3","mass":0.9,"morphology":"compact","dominance":0.9}]}