{"seed":"kc:cleanroom:v2:karpathy:2026-08-18","identity":{"family":"pulsar","label":"Andrej Karpathy","monogram":"AK","avatar":null,"presence":{"mode":"brief_intro","subtitle":"由语言模型训练、低层实现、教学与 Agent 研究流程形成的知识星图"}},"composition":{"archetype":"dominant_core_satellites","asymmetry":0.4,"openness":0.55,"dominant_axis":"radial"},"field":{"density":"medium","dust_family":"cold_filament","temperature_bias":"cool_neutral"},"stars":{"family":"subtle_point","temperature_variation":"medium"},"motion":{"temperament":"balanced"},"anchors":[{"id":"A1","role":"provenance","prominence":"medium","galaxies":["G1"]},{"id":"A2","role":"provenance","prominence":"medium","galaxies":["G2"]},{"id":"A3","role":"provenance","prominence":"medium","galaxies":["G3"]}],"galaxies":[{"id":"G1","mass":0.95,"morphology":"compact","dominance":0.96},{"id":"G2","mass":0.9,"morphology":"elongated","dominance":0.9},{"id":"G3","mass":0.83,"morphology":"stream","dominance":0.8}]}