{"seed":"kc:cleanroom:v2:BurntSushi:2026-08-18","identity":{"family":"minimal_ring","label":"BurntSushi","monogram":"BS","avatar":null,"presence":{"mode":"brief_intro","subtitle":"由长期搜索工具与 Rust 库工程生长出的知识星图"}},"composition":{"archetype":"three_islands","asymmetry":0.48,"openness":0.52,"dominant_axis":"diagonal"},"field":{"density":"sparse","dust_family":"cold_filament","temperature_bias":"cool_neutral"},"stars":{"family":"subtle_point","temperature_variation":"low"},"motion":{"temperament":"balanced"},"anchors":[{"id":"A1","role":"provenance","prominence":"medium","galaxies":["G1"]},{"id":"A2","role":"provenance","prominence":"medium","galaxies":["G2"]},{"id":"A3","role":"provenance","prominence":"medium","galaxies":["G3"]}],"galaxies":[{"id":"G1","mass":0.94,"morphology":"elongated","dominance":0.94},{"id":"G2","mass":0.88,"morphology":"compact","dominance":0.86},{"id":"G3","mass":0.79,"morphology":"compact","dominance":0.76}]}