{"seed":"kc:cleanroom:v2:heloa-net:2026-08-18","identity":{"family":"quiet_star","label":"heloa-net","monogram":"H","avatar":null,"presence":{"mode":"brief_intro","subtitle":"由公开学习、练习与小实验形成的知识星图"}},"composition":{"archetype":"sparse_archipelago","asymmetry":0.58,"openness":0.76,"dominant_axis":"diagonal"},"field":{"density":"very_sparse","dust_family":"almost_empty","temperature_bias":"neutral"},"stars":{"family":"subtle_point","temperature_variation":"low"},"motion":{"temperament":"quiet"},"anchors":[{"id":"A1","role":"provenance","prominence":"medium","galaxies":["G1"]},{"id":"A2","role":"provenance","prominence":"low","galaxies":["G2"]},{"id":"A3","role":"provenance","prominence":"medium","galaxies":["G3"]}],"galaxies":[{"id":"G1","mass":0.58,"morphology":"fragmented","dominance":0.52},{"id":"G2","mass":0.42,"morphology":"compact","dominance":0.36},{"id":"G3","mass":0.68,"morphology":"compact","dominance":0.7}]}