{"seed":"kc:cleanroom:v2:sindresorhus:2026-08-18","identity":{"family":"minimal_ring","label":"Sindre Sorhus","monogram":"SS","avatar":null,"presence":{"mode":"brief_intro","subtitle":"由类型工具、HTTP 客户端与开源策展形成的知识星图"}},"composition":{"archetype":"three_islands","asymmetry":0.46,"openness":0.62,"dominant_axis":"diagonal"},"field":{"density":"sparse","dust_family":"almost_empty","temperature_bias":"cool_neutral"},"stars":{"family":"subtle_point","temperature_variation":"low"},"motion":{"temperament":"balanced"},"anchors":[{"id":"A1","role":"provenance","prominence":"medium","galaxies":["G1"]},{"id":"A2","role":"provenance","prominence":"medium","galaxies":["G2"]},{"id":"A3","role":"provenance","prominence":"medium","galaxies":["G3"]}],"galaxies":[{"id":"G1","mass":0.82,"morphology":"compact","dominance":0.82},{"id":"G2","mass":0.88,"morphology":"compact","dominance":0.9},{"id":"G3","mass":0.76,"morphology":"cloud","dominance":0.72}]}