{"seed":"kc:cleanroom:v2:tiangolo:2026-08-18","identity":{"family":"binary_star","label":"tiangolo","monogram":"T","avatar":null,"presence":{"mode":"brief_intro","subtitle":"由 API 框架产品与跨项目维护实践形成的知识星图"}},"composition":{"archetype":"dual_core","asymmetry":0.38,"openness":0.5,"dominant_axis":"diagonal"},"field":{"density":"sparse","dust_family":"cold_filament","temperature_bias":"neutral"},"stars":{"family":"subtle_point","temperature_variation":"low"},"motion":{"temperament":"balanced"},"anchors":[{"id":"A1","role":"provenance","prominence":"medium","galaxies":["G1"]},{"id":"A2","role":"provenance","prominence":"medium","galaxies":["G2"]}],"galaxies":[{"id":"G1","mass":0.92,"morphology":"compact","dominance":0.94},{"id":"G2","mass":0.8,"morphology":"stream","dominance":0.78}]}
